{
  "schema_version": "v1alpha1",
  "policy_id": "cd542e3e-41b0-46a0-b1f2-b27af9eb9fe4",
  "institution_id": "5d3dca03-89a0-4fb0-99ee-5f39ef5a6f0c",
  "name": "Promotion requires evidence and human approval",
  "description": "No learning enters the commons without replay evidence and one accountable human approver.",
  "applies_to": ["promotion_record", "commons_entry"],
  "rules": [
    {
      "rule_id": "replay-evidence",
      "effect": "require_approval",
      "condition": "candidate_kind in ['skill', 'review_heuristic']",
      "requires": ["benchmark_result", "skill_candidate"],
      "min_approvals": 1
    }
  ],
  "created_by": {
    "actor_id": "52a203e8-0a20-4f0b-9b3d-78631e00d6ab",
    "actor_type": "human",
    "display_name": "Quentin"
  },
  "created_at": "2026-04-24T09:00:00Z"
}
